{
  "$schema": "./schemas/catalogue-details.schema.json",
  "schema_version": "invatrace.catalogue.details.v1",
  "catalogue_version": "2.2.0",
  "reviewed_at": "2026-09-13",
  "record_count": 32,
  "sources": [
    {"source_id":"safety-malaysia-nap","title":"National Action Plan on Invasive Alien Species 2021–2025","publisher":"Government of Malaysia","url":"https://www.doa.gov.my/doa/resources/aktiviti_sumber/sumber_awam/penerbitan/buku/national_action_plan_on_invasive_alien_species_2021-2025.pdf","accessed":"2026-09-13","reuse_status":"Linked reference; safety principles are paraphrased."},
    {"source_id":"acacia-auriculiformis-ifas","title":"Acacia auriculiformis","publisher":"University of Florida IFAS","url":"https://plant-directory.ifas.ufl.edu/plant-directory/acacia-auriculiformis/","accessed":"2026-09-13","reuse_status":"Linked reference; botanical facts are paraphrased."},
    {"source_id":"doa-ias-2025","title":"Malaysia Factsheet on Invasive Alien Species in the Agricultural and Forestry Sectors 2025","publisher":"Department of Agriculture Malaysia","url":"https://www.doa.gov.my/doa/resources/aktiviti_sumber/sumber_awam/penerbitan/buku/malaysia_factsheet_invasive_alien_species_agricultural_forestry_sector_2025.pdf","accessed":"2026-09-13","reuse_status":"Linked Malaysian government reference; factual summaries are paraphrased."},
    {"source_id":"arachis-nparks","title":"Arachis pintoi","publisher":"National Parks Board Singapore","url":"https://www.nparks.gov.sg/florafaunaweb/flora/1/6/1684","accessed":"2026-09-13","reuse_status":"Linked regional authority reference; botanical facts are paraphrased."},
    {"source_id":"calopogonium-weeds-au","title":"Calopogonium mucunoides","publisher":"Weeds of Australia","url":"https://keyserver.lucidcentral.org/weeds/data/media/Html/calopogonium_mucunoides.htm","accessed":"2026-09-13","reuse_status":"Linked reference; identification and impact facts are paraphrased."},
    {"source_id":"cecropia-weeds-au","title":"Cecropia species","publisher":"Weeds of Australia","url":"https://keyserver.lucidcentral.org/weeds/data/media/Html/cecropia_species.htm","accessed":"2026-09-13","reuse_status":"Linked reference; identification and impact facts are paraphrased."},
    {"source_id":"cleome-wa","title":"Kimberley residents asked to check garden for invasive weed","publisher":"Government of Western Australia","url":"https://www.wa.gov.au/government/announcements/kimberley-residents-asked-check-garden-invasive-weed","accessed":"2026-09-13","reuse_status":"Linked government reference; factual summaries are paraphrased."},
    {"source_id":"cynodon-irri","title":"Cynodon dactylon","publisher":"International Rice Research Institute","url":"https://keyserver.lucidcentral.org/key-server/data/08050103-0a0e-4e01-8a03-040d0c020e0a/media/Html/Cynodon_dactylon.htm","accessed":"2026-09-13","reuse_status":"Linked research reference; botanical facts are paraphrased."},
    {"source_id":"cyperus-irri","title":"Cyperus rotundus","publisher":"International Rice Research Institute","url":"https://keyserver.lucidcentral.org/key-server/data/08050103-0a0e-4e01-8a03-040d0c020e0a/media/Html/Cyperus_rotundus.htm","accessed":"2026-09-13","reuse_status":"Linked research reference; botanical facts are paraphrased."},
    {"source_id":"eleusine-irri","title":"Eleusine indica","publisher":"International Rice Research Institute","url":"https://keyserver.lucidcentral.org/key-server/data/08050103-0a0e-4e01-8a03-040d0c020e0a/media/Html/Eleusine_indica.htm","accessed":"2026-09-13","reuse_status":"Linked research reference; botanical facts are paraphrased."},
    {"source_id":"impatiens-nparks","title":"Impatiens balsamina","publisher":"National Parks Board Singapore","url":"https://www.nparks.gov.sg/florafaunaweb/flora/2/1/2121","accessed":"2026-09-13","reuse_status":"Linked regional authority reference; botanical facts are paraphrased."},
    {"source_id":"limnocharis-aus-ag","title":"Limnocharis","publisher":"Australian Department of Agriculture, Fisheries and Forestry","url":"https://www.agriculture.gov.au/biosecurity-trade/policy/australia/naqs/naqs-target-lists/limnocharis","accessed":"2026-09-13","reuse_status":"Linked government reference; identification and impact facts are paraphrased."},
    {"source_id":"paspalum-calipc","title":"Paspalum vaginatum profile","publisher":"California Invasive Plant Council","url":"https://www.cal-ipc.org/plants/profile/paspalum-vaginatum-profile/","accessed":"2026-09-13","reuse_status":"Linked nonprofit reference; factual summaries are paraphrased."},
    {"source_id":"mission-grass-dcceew","title":"Invasive pasture grasses: perennial mission grass","publisher":"Australian Department of Climate Change, Energy, the Environment and Water","url":"https://www.dcceew.gov.au/environment/biodiversity/threatened/threat-abatement-advices/invasive-pasture-grasses-perennial-mission","accessed":"2026-09-13","reuse_status":"Linked government reference; factual summaries are paraphrased."},
    {"source_id":"rottboellia-fdacs","title":"Rottboellia cochinchinensis (Itchgrass)","publisher":"Florida Department of Agriculture and Consumer Services","url":"https://www.fdacs.gov/Agriculture-Industry/Pests-and-Diseases/Plant-Pests-and-Diseases/Noxious-Weeds/Rottboellia-cochinchinensis-Itchgrass","accessed":"2026-09-13","reuse_status":"Linked government reference; factual summaries are paraphrased."},
    {"source_id":"ruellia-qld","title":"Green shrimp plant risk assessment","publisher":"Queensland Government","url":"https://www.daf.qld.gov.au/__data/assets/pdf_file/0009/60030/IPA-Green-Shrimp-Plant-Risk-Assessment.pdf","accessed":"2026-09-13","reuse_status":"Linked government assessment; conclusions are paraphrased with uncertainty retained."},
    {"source_id":"salvinia-nsw","title":"Salvinia","publisher":"NSW Government WeedWise","url":"https://weeds.dpi.nsw.gov.au/Weed/Salvinia","accessed":"2026-09-13","reuse_status":"Linked government reference; identification and impact facts are paraphrased."},
    {"source_id":"striga-aphis","title":"Witchweed","publisher":"USDA Animal and Plant Health Inspection Service","url":"https://www.aphis.usda.gov/plant-pests-diseases/witchweed","accessed":"2026-09-13","reuse_status":"Linked government reference; factual summaries are paraphrased."},
    {"source_id":"synedrella-pacific","title":"Cinderella weed","publisher":"Pacific Pests, Pathogens and Weeds","url":"https://apps.lucidcentral.org/pppw_v13/text/web_full/entities/cinderella_weed_490.htm","accessed":"2026-09-13","reuse_status":"Linked extension reference; botanical facts are paraphrased."},
    {"source_id":"para-grass-dcceew","title":"Invasive pasture grasses: para grass","publisher":"Australian Department of Climate Change, Energy, the Environment and Water","url":"https://www.dcceew.gov.au/environment/biodiversity/threatened/threat-abatement-advices/invasive-pasture-grasses-para-grass","accessed":"2026-09-13","reuse_status":"Linked government reference; factual summaries are paraphrased."},
    {"source_id":"asclepias-nparks","title":"Asclepias curassavica","publisher":"National Parks Board Singapore","url":"https://www.nparks.gov.sg/florafaunaweb/flora/1/6/1693","accessed":"2026-09-13","reuse_status":"Linked regional authority reference; botanical and safety facts are paraphrased."},
    {"source_id":"bidens-ifas","title":"Hairy beggarticks management","publisher":"University of Florida IFAS Extension","url":"https://ask.ifas.ufl.edu/publication/EP572","accessed":"2026-09-13","reuse_status":"Linked extension reference; botanical and management facts are paraphrased."},
    {"source_id":"chromolaena-qld","title":"Siam weed","publisher":"Queensland Government","url":"https://www.business.qld.gov.au/industries/farms-fishing-forestry/agriculture/biosecurity/plants/invasive/restricted/siam-weed","accessed":"2026-09-13","reuse_status":"Linked government reference; factual summaries are paraphrased."},
    {"source_id":"eichhornia-qld","title":"Water hyacinth","publisher":"Queensland Government","url":"https://www.business.qld.gov.au/industries/farms-fishing-forestry/agriculture/biosecurity/plants/invasive/restricted/water-hyacinth","accessed":"2026-09-13","reuse_status":"Linked government reference; factual summaries are paraphrased."},
    {"source_id":"leucaena-qld","title":"Leucaena","publisher":"Queensland Government","url":"https://www.business.qld.gov.au/industries/farms-fishing-forestry/agriculture/biosecurity/plants/invasive/other/leucaena","accessed":"2026-09-13","reuse_status":"Linked government reference; factual summaries are paraphrased."},
    {"source_id":"guinea-grass-hisc","title":"Guinea grass","publisher":"Hawaii Invasive Species Council","url":"https://dlnr.hawaii.gov/hisc/info/invasive-species-profiles/guinea-grass/","accessed":"2026-09-13","reuse_status":"Linked government reference; factual summaries are paraphrased."},
    {"source_id":"mikania-qld","title":"Mikania vine","publisher":"Queensland Government","url":"https://www.business.qld.gov.au/industries/farms-fishing-forestry/agriculture/biosecurity/plants/invasive/restricted/mikania-vine","accessed":"2026-09-13","reuse_status":"Linked government reference; factual summaries are paraphrased."},
    {"source_id":"mimosa-diplotricha-qld","title":"Giant sensitive plant","publisher":"Queensland Government","url":"https://www.business.qld.gov.au/industries/farms-fishing-forestry/agriculture/biosecurity/plants/invasive/restricted/giant-sensitive-plant","accessed":"2026-09-13","reuse_status":"Linked government reference; factual summaries are paraphrased."},
    {"source_id":"mimosa-pigra-qld","title":"Mimosa pigra","publisher":"Queensland Government","url":"https://www.business.qld.gov.au/industries/farms-fishing-forestry/agriculture/biosecurity/plants/invasive/restricted/mimosa-pigra","accessed":"2026-09-13","reuse_status":"Linked government reference; factual summaries are paraphrased."},